{
  "schemaVersion": "1.0",
  "policy": "read-only",
  "before": {
    "repository": {
      ".spec": {
        "kind": "directory"
      },
      ".spec/bitz.yaml": {
        "kind": "file",
        "executable": false,
        "sha256": "837bba23fb6873ae6b82ab682a885fbfeef29ebc80e331bf172f4376067333f8"
      },
      ".spec/tasks": {
        "kind": "directory"
      },
      ".spec/tasks/TASK-001.md": {
        "kind": "file",
        "executable": false,
        "sha256": "b5c556d740e47ddb1e9f81cf4a386c28419aee5e76c4e93e44b2b581f248bb75"
      },
      "src": {
        "kind": "directory"
      },
      "src/app.py": {
        "kind": "file",
        "executable": false,
        "sha256": "8ff88919a6004572b4249e0f72b28ed9945e61bdd0e2e7d79ddb9c5b1248674f"
      }
    },
    "git": {
      "status": " M src/app.py\n",
      "index": "100644 786140defb3b8c65a27d56a3909d4cd22cac57b3 0\t.spec/bitz.yaml\n100644 e8a9ef102d49cb190e2bed443b43e8959c6fcb9c 0\t.spec/tasks/TASK-001.md\n100644 62a0161c9eab0d2d827a7795cc8831d1324e3bd9 0\tsrc/app.py\n"
    },
    "home": {},
    "cache": {},
    "temporary": {}
  },
  "after": {
    "repository": {
      ".spec": {
        "kind": "directory"
      },
      ".spec/bitz.yaml": {
        "kind": "file",
        "executable": false,
        "sha256": "837bba23fb6873ae6b82ab682a885fbfeef29ebc80e331bf172f4376067333f8"
      },
      ".spec/tasks": {
        "kind": "directory"
      },
      ".spec/tasks/TASK-001.md": {
        "kind": "file",
        "executable": false,
        "sha256": "b5c556d740e47ddb1e9f81cf4a386c28419aee5e76c4e93e44b2b581f248bb75"
      },
      "src": {
        "kind": "directory"
      },
      "src/app.py": {
        "kind": "file",
        "executable": false,
        "sha256": "8ff88919a6004572b4249e0f72b28ed9945e61bdd0e2e7d79ddb9c5b1248674f"
      }
    },
    "git": {
      "status": " M src/app.py\n",
      "index": "100644 786140defb3b8c65a27d56a3909d4cd22cac57b3 0\t.spec/bitz.yaml\n100644 e8a9ef102d49cb190e2bed443b43e8959c6fcb9c 0\t.spec/tasks/TASK-001.md\n100644 62a0161c9eab0d2d827a7795cc8831d1324e3bd9 0\tsrc/app.py\n"
    },
    "home": {},
    "cache": {},
    "temporary": {}
  }
}
