{
  "schemaVersion": "1.0",
  "policy": "read-only",
  "before": {
    "repository": {
      ".spec": {
        "kind": "directory"
      },
      ".spec/bitz.yaml": {
        "kind": "file",
        "executable": false,
        "sha256": "88d6819ec9014c159c6a44213cbbc98358c4294b49830789afaf91a605653f8f"
      },
      "apps": {
        "kind": "directory"
      },
      "apps/web": {
        "kind": "directory"
      },
      "apps/web/.spec": {
        "kind": "directory"
      },
      "apps/web/.spec/bitz.yaml": {
        "kind": "file",
        "executable": false,
        "sha256": "81546bca40d2dd1968ad6e70d0ae8d1b1d516758cfd347c690920460d006ad2f"
      },
      "apps/web/.spec/requirements": {
        "kind": "directory"
      },
      "apps/web/.spec/requirements/REQ-001.md": {
        "kind": "file",
        "executable": false,
        "sha256": "d485ee33a5f08739802a37d8190aea5cf0adfecf673f02c9858d1aae3e3d4816"
      },
      "services": {
        "kind": "directory"
      },
      "services/api": {
        "kind": "directory"
      },
      "services/api/.spec": {
        "kind": "directory"
      },
      "services/api/.spec/bitz.yaml": {
        "kind": "file",
        "executable": false,
        "sha256": "eed8d6ff738866b58ca05af89e7ab4e2380c4f1bf8f407b22c3ba54335a05e98"
      },
      "services/api/.spec/technical": {
        "kind": "directory"
      },
      "services/api/.spec/technical/TECH-040.md": {
        "kind": "file",
        "executable": false,
        "sha256": "c246df9db475b9159f54af7bb0d85487531408fbe1337e0ff8981229fd1550a7"
      }
    },
    "git": {
      "status": "",
      "index": "100644 df8f6df4251a2e3f1416c04633360e4c805c511d 0\t.spec/bitz.yaml\n100644 ac059808f07e3c1b7d7b0c9f03b3d835290d952c 0\tapps/web/.spec/bitz.yaml\n100644 f012cfd2abf8299c9deea981025a271e578842bb 0\tapps/web/.spec/requirements/REQ-001.md\n100644 38fd3228ae34bd0714d5983074d98468d6518a7a 0\tservices/api/.spec/bitz.yaml\n100644 707a32bbbaa30f22de4cecff45c4aff85a3b641b 0\tservices/api/.spec/technical/TECH-040.md\n"
    },
    "home": {},
    "cache": {},
    "temporary": {}
  },
  "after": {
    "repository": {
      ".spec": {
        "kind": "directory"
      },
      ".spec/bitz.yaml": {
        "kind": "file",
        "executable": false,
        "sha256": "88d6819ec9014c159c6a44213cbbc98358c4294b49830789afaf91a605653f8f"
      },
      "apps": {
        "kind": "directory"
      },
      "apps/web": {
        "kind": "directory"
      },
      "apps/web/.spec": {
        "kind": "directory"
      },
      "apps/web/.spec/bitz.yaml": {
        "kind": "file",
        "executable": false,
        "sha256": "81546bca40d2dd1968ad6e70d0ae8d1b1d516758cfd347c690920460d006ad2f"
      },
      "apps/web/.spec/requirements": {
        "kind": "directory"
      },
      "apps/web/.spec/requirements/REQ-001.md": {
        "kind": "file",
        "executable": false,
        "sha256": "d485ee33a5f08739802a37d8190aea5cf0adfecf673f02c9858d1aae3e3d4816"
      },
      "services": {
        "kind": "directory"
      },
      "services/api": {
        "kind": "directory"
      },
      "services/api/.spec": {
        "kind": "directory"
      },
      "services/api/.spec/bitz.yaml": {
        "kind": "file",
        "executable": false,
        "sha256": "eed8d6ff738866b58ca05af89e7ab4e2380c4f1bf8f407b22c3ba54335a05e98"
      },
      "services/api/.spec/technical": {
        "kind": "directory"
      },
      "services/api/.spec/technical/TECH-040.md": {
        "kind": "file",
        "executable": false,
        "sha256": "c246df9db475b9159f54af7bb0d85487531408fbe1337e0ff8981229fd1550a7"
      }
    },
    "git": {
      "status": "",
      "index": "100644 df8f6df4251a2e3f1416c04633360e4c805c511d 0\t.spec/bitz.yaml\n100644 ac059808f07e3c1b7d7b0c9f03b3d835290d952c 0\tapps/web/.spec/bitz.yaml\n100644 f012cfd2abf8299c9deea981025a271e578842bb 0\tapps/web/.spec/requirements/REQ-001.md\n100644 38fd3228ae34bd0714d5983074d98468d6518a7a 0\tservices/api/.spec/bitz.yaml\n100644 707a32bbbaa30f22de4cecff45c4aff85a3b641b 0\tservices/api/.spec/technical/TECH-040.md\n"
    },
    "home": {},
    "cache": {},
    "temporary": {}
  }
}
