{
  "schemaVersion": "1.0",
  "policy": "read-only",
  "before": {
    "repository": {
      ".spec": {
        "kind": "directory"
      },
      ".spec/bitz.yaml": {
        "kind": "file",
        "executable": false,
        "sha256": "865054fe830a536dba0da81c177068453da8d0067228707b4308f024ac9ab3b7"
      },
      ".spec/requirements": {
        "kind": "directory"
      },
      ".spec/requirements/REQ-001.md": {
        "kind": "file",
        "executable": false,
        "sha256": "5a4a37588020cda8befcbce47a7336f0e8374dd3efcd4d331a02d45d1e83cc0b"
      },
      "apps": {
        "kind": "directory"
      },
      "apps/web": {
        "kind": "directory"
      },
      "apps/web/.spec": {
        "kind": "directory"
      },
      "apps/web/.spec/bitz.yaml": {
        "kind": "file",
        "executable": false,
        "sha256": "66e92f2e88a36597ec5f93503d1036701cbcda2d15b59c1189298461bbd3f45a"
      },
      "services": {
        "kind": "directory"
      },
      "services/api": {
        "kind": "directory"
      },
      "services/api/.spec": {
        "kind": "directory"
      },
      "services/api/.spec/bitz.yaml": {
        "kind": "file",
        "executable": false,
        "sha256": "eed8d6ff738866b58ca05af89e7ab4e2380c4f1bf8f407b22c3ba54335a05e98"
      }
    },
    "git": {
      "status": "",
      "index": "100644 50d0374949463fdfb3e97b3adf2c02240f8750d3 0\t.spec/bitz.yaml\n100644 ced9b064b42bdce5d5d8514af6b19d789fa1332b 0\t.spec/requirements/REQ-001.md\n100644 8fc032a782b07e30869de3277c79d1e69e71d963 0\tapps/web/.spec/bitz.yaml\n100644 38fd3228ae34bd0714d5983074d98468d6518a7a 0\tservices/api/.spec/bitz.yaml\n"
    },
    "home": {},
    "cache": {},
    "temporary": {}
  },
  "after": {
    "repository": {
      ".spec": {
        "kind": "directory"
      },
      ".spec/bitz.yaml": {
        "kind": "file",
        "executable": false,
        "sha256": "865054fe830a536dba0da81c177068453da8d0067228707b4308f024ac9ab3b7"
      },
      ".spec/requirements": {
        "kind": "directory"
      },
      ".spec/requirements/REQ-001.md": {
        "kind": "file",
        "executable": false,
        "sha256": "5a4a37588020cda8befcbce47a7336f0e8374dd3efcd4d331a02d45d1e83cc0b"
      },
      "apps": {
        "kind": "directory"
      },
      "apps/web": {
        "kind": "directory"
      },
      "apps/web/.spec": {
        "kind": "directory"
      },
      "apps/web/.spec/bitz.yaml": {
        "kind": "file",
        "executable": false,
        "sha256": "66e92f2e88a36597ec5f93503d1036701cbcda2d15b59c1189298461bbd3f45a"
      },
      "services": {
        "kind": "directory"
      },
      "services/api": {
        "kind": "directory"
      },
      "services/api/.spec": {
        "kind": "directory"
      },
      "services/api/.spec/bitz.yaml": {
        "kind": "file",
        "executable": false,
        "sha256": "eed8d6ff738866b58ca05af89e7ab4e2380c4f1bf8f407b22c3ba54335a05e98"
      }
    },
    "git": {
      "status": "",
      "index": "100644 50d0374949463fdfb3e97b3adf2c02240f8750d3 0\t.spec/bitz.yaml\n100644 ced9b064b42bdce5d5d8514af6b19d789fa1332b 0\t.spec/requirements/REQ-001.md\n100644 8fc032a782b07e30869de3277c79d1e69e71d963 0\tapps/web/.spec/bitz.yaml\n100644 38fd3228ae34bd0714d5983074d98468d6518a7a 0\tservices/api/.spec/bitz.yaml\n"
    },
    "home": {},
    "cache": {},
    "temporary": {}
  }
}
