{
  "schemaVersion": "1.0",
  "policy": "read-only",
  "before": {
    "repository": {
      ".spec": {
        "kind": "directory"
      },
      ".spec/bitz.yaml": {
        "kind": "file",
        "executable": false,
        "sha256": "837bba23fb6873ae6b82ab682a885fbfeef29ebc80e331bf172f4376067333f8"
      },
      ".spec/technical": {
        "kind": "directory"
      }
    },
    "git": {
      "status": " D .spec/technical/TECH-001.md\n",
      "index": "100644 786140defb3b8c65a27d56a3909d4cd22cac57b3 0\t.spec/bitz.yaml\n100644 2e670c88338f1b250b6e4dc59130ff3e008f1ac2 0\t.spec/technical/TECH-001.md\n"
    },
    "home": {},
    "cache": {},
    "temporary": {}
  },
  "after": {
    "repository": {
      ".spec": {
        "kind": "directory"
      },
      ".spec/bitz.yaml": {
        "kind": "file",
        "executable": false,
        "sha256": "837bba23fb6873ae6b82ab682a885fbfeef29ebc80e331bf172f4376067333f8"
      },
      ".spec/technical": {
        "kind": "directory"
      }
    },
    "git": {
      "status": " D .spec/technical/TECH-001.md\n",
      "index": "100644 786140defb3b8c65a27d56a3909d4cd22cac57b3 0\t.spec/bitz.yaml\n100644 2e670c88338f1b250b6e4dc59130ff3e008f1ac2 0\t.spec/technical/TECH-001.md\n"
    },
    "home": {},
    "cache": {},
    "temporary": {}
  }
}
