{
  "schemaVersion": "1.0",
  "policy": "read-only",
  "before": {
    "repository": {
      ".spec": {
        "kind": "directory"
      },
      ".spec/bitz.yaml": {
        "kind": "file",
        "executable": false,
        "sha256": "fe500d2a4611b34c1166ed5f498393f4be32d511dad23ff52d58d223ce7ab7b5"
      },
      "apps": {
        "kind": "directory"
      },
      "apps/web": {
        "kind": "directory"
      },
      "apps/web/.spec": {
        "kind": "directory"
      },
      "apps/web/.spec/bitz.yaml": {
        "kind": "file",
        "executable": false,
        "sha256": "66e92f2e88a36597ec5f93503d1036701cbcda2d15b59c1189298461bbd3f45a"
      },
      "docs": {
        "kind": "directory"
      },
      "docs/notes.md": {
        "kind": "file",
        "executable": false,
        "sha256": "0f51e3a4acd43974ab8fcfdb7a022dd80e34d65c33fa35fb7fc0db591192284b"
      },
      "services": {
        "kind": "directory"
      },
      "services/api": {
        "kind": "directory"
      },
      "services/api/.spec": {
        "kind": "directory"
      },
      "services/api/.spec/bitz.yaml": {
        "kind": "file",
        "executable": false,
        "sha256": "eed8d6ff738866b58ca05af89e7ab4e2380c4f1bf8f407b22c3ba54335a05e98"
      }
    },
    "git": null,
    "home": {},
    "cache": {},
    "temporary": {}
  },
  "after": {
    "repository": {
      ".spec": {
        "kind": "directory"
      },
      ".spec/bitz.yaml": {
        "kind": "file",
        "executable": false,
        "sha256": "fe500d2a4611b34c1166ed5f498393f4be32d511dad23ff52d58d223ce7ab7b5"
      },
      "apps": {
        "kind": "directory"
      },
      "apps/web": {
        "kind": "directory"
      },
      "apps/web/.spec": {
        "kind": "directory"
      },
      "apps/web/.spec/bitz.yaml": {
        "kind": "file",
        "executable": false,
        "sha256": "66e92f2e88a36597ec5f93503d1036701cbcda2d15b59c1189298461bbd3f45a"
      },
      "docs": {
        "kind": "directory"
      },
      "docs/notes.md": {
        "kind": "file",
        "executable": false,
        "sha256": "0f51e3a4acd43974ab8fcfdb7a022dd80e34d65c33fa35fb7fc0db591192284b"
      },
      "services": {
        "kind": "directory"
      },
      "services/api": {
        "kind": "directory"
      },
      "services/api/.spec": {
        "kind": "directory"
      },
      "services/api/.spec/bitz.yaml": {
        "kind": "file",
        "executable": false,
        "sha256": "eed8d6ff738866b58ca05af89e7ab4e2380c4f1bf8f407b22c3ba54335a05e98"
      }
    },
    "git": null,
    "home": {},
    "cache": {},
    "temporary": {}
  }
}
