{
  "schemaVersion": "1.0",
  "policy": "read-only",
  "before": {
    "repository": {
      ".spec": {
        "kind": "directory"
      },
      ".spec/bitz.yaml": {
        "kind": "file",
        "executable": false,
        "sha256": "837bba23fb6873ae6b82ab682a885fbfeef29ebc80e331bf172f4376067333f8"
      },
      ".spec/requirements": {
        "kind": "directory"
      },
      ".spec/requirements/REQ-002.md": {
        "kind": "file",
        "executable": false,
        "sha256": "8b546f4fe4773d0fcc95490786d95f2a8800a86aa65298cb89f2fcd81ac26ae3"
      }
    },
    "git": {
      "status": "",
      "index": "100644 786140defb3b8c65a27d56a3909d4cd22cac57b3 0\t.spec/bitz.yaml\n100644 3037a6941da82ecaf80e9d6b946e00b89572d3ba 0\t.spec/requirements/REQ-002.md\n"
    },
    "home": {},
    "cache": {},
    "temporary": {}
  },
  "after": {
    "repository": {
      ".spec": {
        "kind": "directory"
      },
      ".spec/bitz.yaml": {
        "kind": "file",
        "executable": false,
        "sha256": "837bba23fb6873ae6b82ab682a885fbfeef29ebc80e331bf172f4376067333f8"
      },
      ".spec/requirements": {
        "kind": "directory"
      },
      ".spec/requirements/REQ-002.md": {
        "kind": "file",
        "executable": false,
        "sha256": "8b546f4fe4773d0fcc95490786d95f2a8800a86aa65298cb89f2fcd81ac26ae3"
      }
    },
    "git": {
      "status": "",
      "index": "100644 786140defb3b8c65a27d56a3909d4cd22cac57b3 0\t.spec/bitz.yaml\n100644 3037a6941da82ecaf80e9d6b946e00b89572d3ba 0\t.spec/requirements/REQ-002.md\n"
    },
    "home": {},
    "cache": {},
    "temporary": {}
  }
}
