{
  "schemaVersion": "1.0",
  "policy": "read-only",
  "before": {
    "repository": {
      ".spec": {
        "kind": "directory"
      },
      ".spec/bitz.yaml": {
        "kind": "file",
        "executable": false,
        "sha256": "88d6819ec9014c159c6a44213cbbc98358c4294b49830789afaf91a605653f8f"
      },
      ".spec/reports": {
        "kind": "file",
        "executable": false,
        "sha256": "ac720c5298c3b31fd4c22be96bb9c2111215232da143082cf999b4190435625f"
      },
      ".spec/requirements": {
        "kind": "directory"
      },
      ".spec/requirements/REQ-001.md": {
        "kind": "file",
        "executable": false,
        "sha256": "5a4a37588020cda8befcbce47a7336f0e8374dd3efcd4d331a02d45d1e83cc0b"
      },
      "apps": {
        "kind": "directory"
      },
      "apps/web": {
        "kind": "directory"
      },
      "apps/web/.spec": {
        "kind": "directory"
      },
      "apps/web/.spec/bitz.yaml": {
        "kind": "file",
        "executable": false,
        "sha256": "66e92f2e88a36597ec5f93503d1036701cbcda2d15b59c1189298461bbd3f45a"
      },
      "services": {
        "kind": "directory"
      },
      "services/api": {
        "kind": "directory"
      },
      "services/api/src": {
        "kind": "directory"
      },
      "services/api/src/session.py": {
        "kind": "file",
        "executable": false,
        "sha256": "47a8c4927771862af2a7dd2d1776e68d6ef06055fa6ef6de596a76b38a6e0303"
      }
    },
    "git": {
      "status": "",
      "index": "100644 df8f6df4251a2e3f1416c04633360e4c805c511d 0\t.spec/bitz.yaml\n100644 4088d34ffe61c4dd325e6bdb6fbad1390d020c04 0\t.spec/reports\n100644 ced9b064b42bdce5d5d8514af6b19d789fa1332b 0\t.spec/requirements/REQ-001.md\n100644 8fc032a782b07e30869de3277c79d1e69e71d963 0\tapps/web/.spec/bitz.yaml\n100644 288c4c1c7dc99b08d8bdc182acf2b89b8dc1ee9f 0\tservices/api/src/session.py\n"
    },
    "home": {},
    "cache": {},
    "temporary": {}
  },
  "after": {
    "repository": {
      ".spec": {
        "kind": "directory"
      },
      ".spec/bitz.yaml": {
        "kind": "file",
        "executable": false,
        "sha256": "88d6819ec9014c159c6a44213cbbc98358c4294b49830789afaf91a605653f8f"
      },
      ".spec/reports": {
        "kind": "file",
        "executable": false,
        "sha256": "ac720c5298c3b31fd4c22be96bb9c2111215232da143082cf999b4190435625f"
      },
      ".spec/requirements": {
        "kind": "directory"
      },
      ".spec/requirements/REQ-001.md": {
        "kind": "file",
        "executable": false,
        "sha256": "5a4a37588020cda8befcbce47a7336f0e8374dd3efcd4d331a02d45d1e83cc0b"
      },
      "apps": {
        "kind": "directory"
      },
      "apps/web": {
        "kind": "directory"
      },
      "apps/web/.spec": {
        "kind": "directory"
      },
      "apps/web/.spec/bitz.yaml": {
        "kind": "file",
        "executable": false,
        "sha256": "66e92f2e88a36597ec5f93503d1036701cbcda2d15b59c1189298461bbd3f45a"
      },
      "services": {
        "kind": "directory"
      },
      "services/api": {
        "kind": "directory"
      },
      "services/api/src": {
        "kind": "directory"
      },
      "services/api/src/session.py": {
        "kind": "file",
        "executable": false,
        "sha256": "47a8c4927771862af2a7dd2d1776e68d6ef06055fa6ef6de596a76b38a6e0303"
      }
    },
    "git": {
      "status": "",
      "index": "100644 df8f6df4251a2e3f1416c04633360e4c805c511d 0\t.spec/bitz.yaml\n100644 4088d34ffe61c4dd325e6bdb6fbad1390d020c04 0\t.spec/reports\n100644 ced9b064b42bdce5d5d8514af6b19d789fa1332b 0\t.spec/requirements/REQ-001.md\n100644 8fc032a782b07e30869de3277c79d1e69e71d963 0\tapps/web/.spec/bitz.yaml\n100644 288c4c1c7dc99b08d8bdc182acf2b89b8dc1ee9f 0\tservices/api/src/session.py\n"
    },
    "home": {},
    "cache": {},
    "temporary": {}
  }
}
