{
  "schemaVersion": "1.0",
  "policy": "read-only",
  "before": {
    "repository": {
      ".spec": {
        "kind": "directory"
      },
      ".spec/bitz.yaml": {
        "kind": "file",
        "executable": false,
        "sha256": "88d6819ec9014c159c6a44213cbbc98358c4294b49830789afaf91a605653f8f"
      },
      "apps": {
        "kind": "directory"
      },
      "apps/web": {
        "kind": "directory"
      },
      "apps/web/.spec": {
        "kind": "directory"
      },
      "apps/web/.spec/bitz.yaml": {
        "kind": "file",
        "executable": false,
        "sha256": "66e92f2e88a36597ec5f93503d1036701cbcda2d15b59c1189298461bbd3f45a"
      },
      "services": {
        "kind": "directory"
      },
      "services/api": {
        "kind": "directory"
      },
      "services/api/.spec": {
        "kind": "directory"
      },
      "services/api/.spec/bitz.yaml": {
        "kind": "file",
        "executable": false,
        "sha256": "eed8d6ff738866b58ca05af89e7ab4e2380c4f1bf8f407b22c3ba54335a05e98"
      }
    },
    "git": null,
    "home": {},
    "cache": {},
    "temporary": {}
  },
  "after": {
    "repository": {
      ".spec": {
        "kind": "directory"
      },
      ".spec/bitz.yaml": {
        "kind": "file",
        "executable": false,
        "sha256": "88d6819ec9014c159c6a44213cbbc98358c4294b49830789afaf91a605653f8f"
      },
      "apps": {
        "kind": "directory"
      },
      "apps/web": {
        "kind": "directory"
      },
      "apps/web/.spec": {
        "kind": "directory"
      },
      "apps/web/.spec/bitz.yaml": {
        "kind": "file",
        "executable": false,
        "sha256": "66e92f2e88a36597ec5f93503d1036701cbcda2d15b59c1189298461bbd3f45a"
      },
      "services": {
        "kind": "directory"
      },
      "services/api": {
        "kind": "directory"
      },
      "services/api/.spec": {
        "kind": "directory"
      },
      "services/api/.spec/bitz.yaml": {
        "kind": "file",
        "executable": false,
        "sha256": "eed8d6ff738866b58ca05af89e7ab4e2380c4f1bf8f407b22c3ba54335a05e98"
      }
    },
    "git": null,
    "home": {},
    "cache": {},
    "temporary": {}
  }
}
