{
  "schemaVersion": "1.0",
  "policy": "read-only",
  "before": {
    "repository": {
      ".spec": {
        "kind": "directory"
      },
      ".spec/bitz.yaml": {
        "kind": "file",
        "executable": false,
        "sha256": "bde7962c3d55867151d3ac8e4b037f99a99a3c1de4b7a611a3ad8dd95dc0e25c"
      },
      ".spec/decisions": {
        "kind": "directory"
      },
      ".spec/decisions/ADR-001.md": {
        "kind": "file",
        "executable": false,
        "sha256": "0ca092adfd45d06effdca1c90ed2c2bb0b99e9de61c0f17d6b0f1a824ee00402"
      },
      ".spec/requirements": {
        "kind": "directory"
      },
      ".spec/requirements/REQ-001.md": {
        "kind": "file",
        "executable": false,
        "sha256": "4bbd5e3f655696aa61b855c9875ce9c81bbf9d8c9ff3df1cb4ea1ba20750d807"
      },
      ".spec/technical": {
        "kind": "directory"
      },
      ".spec/technical/TECH-001.md": {
        "kind": "file",
        "executable": false,
        "sha256": "afda77ecab7740deba124cde38243776f26871ce07b2203b7816098959692775"
      },
      "src": {
        "kind": "directory"
      },
      "src/auth.py": {
        "kind": "file",
        "executable": false,
        "sha256": "891db46eb3458220b0b14e13475275304f8091d580143003f669440b4c0102aa"
      },
      "src/session.py": {
        "kind": "file",
        "executable": false,
        "sha256": "47a8c4927771862af2a7dd2d1776e68d6ef06055fa6ef6de596a76b38a6e0303"
      },
      "tests": {
        "kind": "directory"
      },
      "tests/test_auth.py": {
        "kind": "file",
        "executable": false,
        "sha256": "13eead6681ce261ab5fc34eb64cab2c8fc9a8d0cd832a862dff27bc6c43597b2"
      },
      "tests/test_session.py": {
        "kind": "file",
        "executable": false,
        "sha256": "b5f76024fd4602d6f06bc31cdface8ff12a70455d0b0e8bb12b6435a40cf3abc"
      }
    },
    "git": {
      "status": "?? .spec/bitz.yaml\n?? .spec/decisions/ADR-001.md\n?? .spec/requirements/REQ-001.md\n?? .spec/technical/TECH-001.md\n?? src/auth.py\n?? src/session.py\n?? tests/test_auth.py\n?? tests/test_session.py\n",
      "index": ""
    },
    "home": {},
    "cache": {},
    "temporary": {}
  },
  "after": {
    "repository": {
      ".spec": {
        "kind": "directory"
      },
      ".spec/bitz.yaml": {
        "kind": "file",
        "executable": false,
        "sha256": "bde7962c3d55867151d3ac8e4b037f99a99a3c1de4b7a611a3ad8dd95dc0e25c"
      },
      ".spec/decisions": {
        "kind": "directory"
      },
      ".spec/decisions/ADR-001.md": {
        "kind": "file",
        "executable": false,
        "sha256": "0ca092adfd45d06effdca1c90ed2c2bb0b99e9de61c0f17d6b0f1a824ee00402"
      },
      ".spec/requirements": {
        "kind": "directory"
      },
      ".spec/requirements/REQ-001.md": {
        "kind": "file",
        "executable": false,
        "sha256": "4bbd5e3f655696aa61b855c9875ce9c81bbf9d8c9ff3df1cb4ea1ba20750d807"
      },
      ".spec/technical": {
        "kind": "directory"
      },
      ".spec/technical/TECH-001.md": {
        "kind": "file",
        "executable": false,
        "sha256": "afda77ecab7740deba124cde38243776f26871ce07b2203b7816098959692775"
      },
      "src": {
        "kind": "directory"
      },
      "src/auth.py": {
        "kind": "file",
        "executable": false,
        "sha256": "891db46eb3458220b0b14e13475275304f8091d580143003f669440b4c0102aa"
      },
      "src/session.py": {
        "kind": "file",
        "executable": false,
        "sha256": "47a8c4927771862af2a7dd2d1776e68d6ef06055fa6ef6de596a76b38a6e0303"
      },
      "tests": {
        "kind": "directory"
      },
      "tests/test_auth.py": {
        "kind": "file",
        "executable": false,
        "sha256": "13eead6681ce261ab5fc34eb64cab2c8fc9a8d0cd832a862dff27bc6c43597b2"
      },
      "tests/test_session.py": {
        "kind": "file",
        "executable": false,
        "sha256": "b5f76024fd4602d6f06bc31cdface8ff12a70455d0b0e8bb12b6435a40cf3abc"
      }
    },
    "git": {
      "status": "?? .spec/bitz.yaml\n?? .spec/decisions/ADR-001.md\n?? .spec/requirements/REQ-001.md\n?? .spec/technical/TECH-001.md\n?? src/auth.py\n?? src/session.py\n?? tests/test_auth.py\n?? tests/test_session.py\n",
      "index": ""
    },
    "home": {},
    "cache": {},
    "temporary": {}
  }
}
