{
  "schemaVersion": "1.0",
  "policy": "read-only",
  "before": {
    "repository": {
      ".spec": {
        "kind": "directory"
      },
      ".spec/bitz.yaml": {
        "kind": "file",
        "executable": false,
        "sha256": "837bba23fb6873ae6b82ab682a885fbfeef29ebc80e331bf172f4376067333f8"
      },
      ".spec/technical": {
        "kind": "directory"
      },
      ".spec/technical/TECH-001.md": {
        "kind": "file",
        "executable": false,
        "sha256": "1bc06086ad6999ffa0cde9d7a53f6d4d8565178d6f0116fce996bd9c389123b1"
      }
    },
    "git": null,
    "home": {},
    "cache": {},
    "temporary": {}
  },
  "after": {
    "repository": {
      ".spec": {
        "kind": "directory"
      },
      ".spec/bitz.yaml": {
        "kind": "file",
        "executable": false,
        "sha256": "837bba23fb6873ae6b82ab682a885fbfeef29ebc80e331bf172f4376067333f8"
      },
      ".spec/technical": {
        "kind": "directory"
      },
      ".spec/technical/TECH-001.md": {
        "kind": "file",
        "executable": false,
        "sha256": "1bc06086ad6999ffa0cde9d7a53f6d4d8565178d6f0116fce996bd9c389123b1"
      }
    },
    "git": null,
    "home": {},
    "cache": {},
    "temporary": {}
  }
}
