{
  "schemaVersion": "1.0",
  "policy": "read-only",
  "before": {
    "repository": {
      ".spec": {
        "kind": "directory"
      },
      ".spec/bitz.yaml": {
        "kind": "file",
        "executable": false,
        "sha256": "649ac16e253e9cb4d116bcfb3b41cb2efb5e24d7f66af48f075ac98d7a037186"
      },
      ".spec/requirements": {
        "kind": "directory"
      },
      ".spec/requirements/REQ-001.md": {
        "kind": "file",
        "executable": false,
        "sha256": "5a4a37588020cda8befcbce47a7336f0e8374dd3efcd4d331a02d45d1e83cc0b"
      }
    },
    "git": {
      "status": "",
      "index": "100644 c9fc6f162067943edf65a6d8a01132247b11900b 0\t.spec/bitz.yaml\n100644 ced9b064b42bdce5d5d8514af6b19d789fa1332b 0\t.spec/requirements/REQ-001.md\n"
    },
    "home": {},
    "cache": {},
    "temporary": {}
  },
  "after": {
    "repository": {
      ".spec": {
        "kind": "directory"
      },
      ".spec/bitz.yaml": {
        "kind": "file",
        "executable": false,
        "sha256": "649ac16e253e9cb4d116bcfb3b41cb2efb5e24d7f66af48f075ac98d7a037186"
      },
      ".spec/requirements": {
        "kind": "directory"
      },
      ".spec/requirements/REQ-001.md": {
        "kind": "file",
        "executable": false,
        "sha256": "5a4a37588020cda8befcbce47a7336f0e8374dd3efcd4d331a02d45d1e83cc0b"
      }
    },
    "git": {
      "status": "",
      "index": "100644 c9fc6f162067943edf65a6d8a01132247b11900b 0\t.spec/bitz.yaml\n100644 ced9b064b42bdce5d5d8514af6b19d789fa1332b 0\t.spec/requirements/REQ-001.md\n"
    },
    "home": {},
    "cache": {},
    "temporary": {}
  }
}
